[
  {
    "id": "Q001",
    "section": 1,
    "tier": "foundation",
    "difficulty": "basic",
    "type": "single_choice",
    "tags": {
      "zh": ["映射", "函数定义", "定义域与陪域"],
      "en": ["mapping", "definition of a function", "domain and codomain"]
    },
    "minutes": 4,
    "space": "S",
    "classic_method": false,
    "zh": {
      "title": "判断合法映射",
      "prompt": "设 X={-1,0,1}，Y={0,1}。下列对应中，哪一个定义了从 X 到 Y 的函数？",
      "choices": [
        "A. 对每个 x∈X，令 f(x)=x²",
        "B. f(-1)=1，f(1)=1，但不给出 f(0)",
        "C. f(-1)=1，f(0)=0，同时规定 f(1)=0 和 f(1)=1",
        "D. 对每个 x∈X，令 f(x)=x+1"
      ],
      "answer": "A",
      "solution": {
        "knowledge": ["函数要求定义域中每个元素都有像", "每个自变量只能对应唯一函数值", "函数值必须属于陪域"],
        "analysis": "逐项检查三个必要条件：X 中是否每个元素都被定义、像是否唯一、像是否全部落在 Y 中。只要有一项失败，就不是从 X 到 Y 的函数。",
        "steps": [
          "检查 A：(-1)²=1，0²=0，1²=1，三个元素均有且仅有一个像。",
          "A 的所有函数值都是 0 或 1，均属于 Y，所以 A 合法。",
          "B 没有给出 f(0)，因此没有覆盖整个定义域 X。",
          "C 让同一个输入 1 对应两个不同值；D 中 f(1)=2∉Y，因此 C、D 均不合法。"
        ],
        "pitfalls": ["只检查公式能否计算，而不检查函数值是否落在指定陪域", "误以为一个输入可以同时对应多个输出"],
        "verification": "把 X 的三个元素逐一代入 A，可得到有序对集合 {(-1,1),(0,0),(1,1)}，每个第一分量恰好出现一次，第二分量均在 Y 中。",
        "takeaway": "判断映射要同时核对“处处有定义、像唯一、像属于陪域”。",
        "extension": "若把 D 的陪域改为 {0,1,2}，则 D 会成为从 X 到该新陪域的函数。"
      }
    },
    "en": {
      "title": "Identify a Valid Mapping",
      "prompt": "Let X={-1,0,1} and Y={0,1}. Which correspondence defines a function from X to Y?",
      "choices": [
        "A. For every x∈X, define f(x)=x²",
        "B. Define f(-1)=1 and f(1)=1, but do not define f(0)",
        "C. Define f(-1)=1 and f(0)=0, while assigning both f(1)=0 and f(1)=1",
        "D. For every x∈X, define f(x)=x+1"
      ],
      "answer": "A",
      "solution": {
        "knowledge": ["every domain element must have an image", "each input must have a unique output", "every output must belong to the codomain"],
        "analysis": "Check the three defining requirements one by one: every element of X must be covered, its image must be unique, and every image must lie in Y. Failure of any one condition invalidates the correspondence.",
        "steps": [
          "For A, (-1)²=1, 0²=0, and 1²=1, so all three inputs have exactly one image.",
          "All outputs in A are either 0 or 1, hence they belong to Y; therefore A is valid.",
          "B leaves f(0) undefined, so it does not cover the whole domain X.",
          "C gives the same input 1 two outputs, while D gives f(1)=2∉Y; therefore C and D are invalid."
        ],
        "pitfalls": ["checking only whether a formula can be evaluated and ignoring the prescribed codomain", "allowing one input to have two different outputs"],
        "verification": "Substitution in A gives the ordered-pair set {(-1,1),(0,0),(1,1)}. Every first component appears exactly once, and every second component lies in Y.",
        "takeaway": "A mapping is a function only when it is defined everywhere on the domain, single-valued, and codomain-respecting.",
        "extension": "If the codomain in D were changed to {0,1,2}, then D would define a function from X to that new codomain."
      }
    }
  },
  {
    "id": "Q002",
    "section": 1,
    "tier": "foundation",
    "difficulty": "basic",
    "type": "fill_blank",
    "tags": {
      "zh": ["函数定义域", "根式", "对数"],
      "en": ["domain", "radical", "logarithm"]
    },
    "minutes": 5,
    "space": "M",
    "classic_method": true,
    "zh": {
      "title": "根式与对数的共同定义域",
      "prompt": "函数 f(x)=√(2-x)+ln(x+1) 的自然定义域为 ______。",
      "answer": "(-1,2]",
      "solution": {
        "knowledge": ["偶次根式要求被开方数非负", "自然对数真数必须严格为正", "复合限制取交集"],
        "analysis": "两个表达式同时出现时，x 必须同时满足根式和对数的定义条件。根式端点可以取到，而对数端点不能取到。",
        "steps": [
          "由 √(2-x) 有意义，得到 2-x≥0，即 x≤2。",
          "由 ln(x+1) 有意义，得到 x+1>0，即 x>-1。",
          "同时满足两条件，取区间 (-1,+∞) 与 (-∞,2] 的交集。",
          "交集为 (-1,2]，其中 -1 被排除而 2 可以取到。"
        ],
        "pitfalls": ["把对数真数条件误写成 x+1≥0", "分别求出两个区间后忘记取交集"],
        "verification": "在 x=2 时函数值为 √0+ln3，有意义；当 x=-1 时出现 ln0，无意义，这与端点开闭一致。",
        "takeaway": "定义域问题的核心是列出全部限制并取交集，严格区分 >0 与 ≥0。",
        "extension": "若把 ln(x+1) 改为 1/ln(x+1)，还需增加 ln(x+1)≠0，即排除 x=0。"
      }
    },
    "en": {
      "title": "Common Domain of a Radical and a Logarithm",
      "prompt": "The natural domain of f(x)=√(2-x)+ln(x+1) is ______.",
      "answer": "(-1,2]",
      "solution": {
        "knowledge": ["an even root requires a nonnegative radicand", "the argument of a natural logarithm must be strictly positive", "simultaneous restrictions are intersected"],
        "analysis": "Because both expressions occur in the same function, x must satisfy both restrictions. The radical may include its zero endpoint, whereas the logarithm may not.",
        "steps": [
          "For √(2-x) to be defined, require 2-x≥0, hence x≤2.",
          "For ln(x+1) to be defined, require x+1>0, hence x>-1.",
          "Intersect (-1,+∞) with (-∞,2].",
          "The intersection is (-1,2]; -1 is excluded and 2 is included."
        ],
        "pitfalls": ["replacing the logarithmic condition x+1>0 with x+1≥0", "listing the two restrictions without taking their intersection"],
        "verification": "At x=2 the value √0+ln3 is defined, while x=-1 would produce ln0, confirming the stated endpoint types.",
        "takeaway": "For a natural domain, collect every restriction, intersect them, and distinguish strict from non-strict inequalities.",
        "extension": "If ln(x+1) were replaced by 1/ln(x+1), one would also require ln(x+1)≠0, excluding x=0."
      }
    }
  },
  {
    "id": "Q003",
    "section": 1,
    "tier": "methods",
    "difficulty": "standard",
    "type": "calculation",
    "tags": {
      "zh": ["复合函数", "复合定义域", "根式分式"],
      "en": ["composite function", "domain of a composition", "radical and rational expression"]
    },
    "minutes": 8,
    "space": "L",
    "classic_method": true,
    "zh": {
      "title": "复合函数及其定义域",
      "prompt": "设 f(x)=√(x+2)，g(u)=1/(u-1)。求 (g∘f)(x) 的解析式及自然定义域。",
      "answer": "(g∘f)(x)=1/(√(x+2)-1)，定义域为 [-2,-1)∪(-1,+∞)。",
      "solution": {
        "knowledge": ["复合函数的代入顺序", "内层函数必须有定义", "内层函数值必须落在外层函数定义域"],
        "analysis": "不能只把 f(x) 代入 g；还必须同时保证根式存在且代入后的外层分母不为零。",
        "steps": [
          "按 g∘f 的顺序，先计算 f(x)=√(x+2)，再将其作为 g 的输入。",
          "代入得到 (g∘f)(x)=g(f(x))=1/(√(x+2)-1)。",
          "内层根式要求 x+2≥0，所以 x≥-2。",
          "外层 g 的输入不能等于 1，因此 √(x+2)≠1，即 x≠-1；合并得 [-2,-1)∪(-1,+∞)。"
        ],
        "pitfalls": ["把 g∘f 错写成 f∘g", "只写 x≥-2，漏掉复合后分母为零的点 x=-1"],
        "verification": "x=-2 时分母为 -1，函数有定义；x=-1 时分母为 0，必须排除；任取 x>-2 且 x≠-1，根式和分母均合法。",
        "takeaway": "复合函数定义域要经过两道检查：内层可算，内层输出还要能进入外层。",
        "extension": "可进一步求 f∘g；其限制与 g∘f 不同，说明复合运算通常不可交换。"
      }
    },
    "en": {
      "title": "A Composite Function and Its Domain",
      "prompt": "Let f(x)=√(x+2) and g(u)=1/(u-1). Find the formula and natural domain of (g∘f)(x).",
      "answer": "(g∘f)(x)=1/(√(x+2)-1), with domain [-2,-1)∪(-1,+∞).",
      "solution": {
        "knowledge": ["order of composition", "the inner function must be defined", "the inner output must lie in the outer domain"],
        "analysis": "Substitution alone is not enough. The radical must exist, and after substitution the denominator of the outer function must remain nonzero.",
        "steps": [
          "The order g∘f means first compute f(x)=√(x+2), then use it as the input of g.",
          "Substitution gives (g∘f)(x)=g(f(x))=1/(√(x+2)-1).",
          "The inner radical requires x+2≥0, so x≥-2.",
          "The input of g cannot equal 1, so √(x+2)≠1, or x≠-1; combining the restrictions gives [-2,-1)∪(-1,+∞)."
        ],
        "pitfalls": ["reversing g∘f into f∘g", "keeping only x≥-2 and missing the zero denominator at x=-1"],
        "verification": "At x=-2 the denominator is -1, so the function is defined. At x=-1 the denominator is 0, so the point must be removed. Every other x≥-2 satisfies both restrictions.",
        "takeaway": "A composite domain requires two checks: the inner function must be evaluable, and its output must be admissible for the outer function.",
        "extension": "One may also find f∘g; its restrictions differ from those of g∘f, illustrating that composition is generally not commutative."
      }
    }
  },
  {
    "id": "Q004",
    "section": 1,
    "tier": "methods",
    "difficulty": "standard",
    "type": "multiple_choice",
    "tags": {
      "zh": ["函数性质", "奇偶性", "有界性"],
      "en": ["function properties", "parity", "boundedness"]
    },
    "minutes": 7,
    "space": "M",
    "classic_method": false,
    "zh": {
      "title": "辨析函数的整体性质",
      "prompt": "设 h(x)=|x|/(1+x²)，定义域为 R。下列结论中正确的是哪些？",
      "choices": [
        "A. h 为偶函数",
        "B. 对所有 x∈R，有 0≤h(x)≤1/2",
        "C. h 是周期函数",
        "D. h 在 [0,+∞) 上严格递增"
      ],
      "answer": "A、B",
      "solution": {
        "knowledge": ["偶函数判定", "代数不等式估计有界性", "周期性与单调性的反例检验"],
        "analysis": "奇偶性可直接比较 h(-x) 与 h(x)；有界性可用 (|x|-1)²≥0；对周期性和单调性，找出与定义矛盾的函数值即可。",
        "steps": [
          "h(-x)=|-x|/(1+(-x)²)=|x|/(1+x²)=h(x)，故 A 正确。",
          "由 (|x|-1)²≥0 得 x²+1≥2|x|，从而 0≤|x|/(1+x²)≤1/2，故 B 正确。",
          "当 |x|→+∞ 时 h(x)→0，而 h(1)=1/2；非零周期函数若重复取值，不会呈现这种远处趋零的行为，因此 C 错误。",
          "h(1)=1/2，而 h(2)=2/5<1/2，所以 h 在 [0,+∞) 上并非严格递增，D 错误。"
        ],
        "pitfalls": ["看到绝对值就只判断偶性而忽略其余选项", "凭图形直觉断言有界或单调，不给代数依据"],
        "verification": "等号 x²+1=2|x| 恰在 |x|=1 时成立，所以最大值 1/2 确实能取到；数值 h(1)=1/2、h(2)=2/5 直接否定 D。",
        "takeaway": "函数性质题应分别按定义或不等式验证，不能由一个局部印象推出整体结论。",
        "extension": "可继续研究 h 在 [0,1] 与 [1,+∞) 上的单调性，但不能使用导数时需通过差值或代数比较完成。"
      }
    },
    "en": {
      "title": "Analyze Global Properties of a Function",
      "prompt": "Let h(x)=|x|/(1+x²) on R. Which statements are correct?",
      "choices": [
        "A. h is even",
        "B. For every x∈R, 0≤h(x)≤1/2",
        "C. h is periodic",
        "D. h is strictly increasing on [0,+∞)"